{
  "metadata": {
    "qegVersion": "0.2",
    "runId": "qeg:run-positive-placement-change-retirement",
    "createdAt": "2026-07-02T00:00:00.000Z",
    "profile": "ipo_controlled",
    "inputArtifacts": [
      {
        "id": "qeg:artifact-positive-placement-change-retirement",
        "adapter": "qeg-native",
        "kind": "test_model",
        "path": "artifacts/input.json",
        "contentHash": "sha256:ee4e3d131531183991b409e2952fb46350ccc4e6fdd0c6fe8c746b7519a15a62"
      }
    ],
    "requiredConnectorStatus": {
      "qeg-native": "success"
    }
  },
  "graph": {
    "metadata": {
      "qegVersion": "0.2",
      "runId": "qeg:run-positive-placement-change-retirement",
      "createdAt": "2026-07-02T00:00:00.000Z",
      "profile": "ipo_controlled",
      "inputArtifacts": [
        {
          "id": "qeg:artifact-positive-placement-change-retirement",
          "adapter": "qeg-native",
          "kind": "test_model",
          "path": "artifacts/input.json",
          "contentHash": "sha256:ee4e3d131531183991b409e2952fb46350ccc4e6fdd0c6fe8c746b7519a15a62"
        }
      ],
      "requiredConnectorStatus": {
        "qeg-native": "success"
      }
    },
    "nodes": [
      {
        "id": "qeg:risk-login-regression",
        "kind": "risk",
        "title": "Login regression escapes release",
        "traceability": {
          "sourceRefs": [
            {
              "id": "qeg:sr-risk-login",
              "path": "docs/risks/login-regression.md"
            }
          ],
          "assumptions": [],
          "confidence": "high"
        },
        "sourceArtifactIds": [],
        "priority": "P1",
        "severity": "high",
        "likelihood": 0.2,
        "businessImpact": 0.8,
        "complianceCriticality": 0.1,
        "evidenceGap": 0,
        "novelty": 0.2
      },
      {
        "id": "hate:AETE-login-001",
        "kind": "test",
        "title": "Automated login regression evidence",
        "traceability": {
          "sourceRefs": [
            {
              "id": "hate:sr-aete-login-001",
              "path": "hate/reports/login-aete.json"
            }
          ],
          "assumptions": [],
          "confidence": "high"
        },
        "sourceArtifactIds": [],
        "layer": "e2e",
        "testExecutionMode": "real",
        "command": "npm run test:e2e -- login",
        "existing": true,
        "evidenceStrength": 0.93,
        "recentGreenRuns": 5,
        "coveredRiskIds": [
          "qeg:risk-login-regression"
        ]
      },
      {
        "id": "mbb:CASE-login-001",
        "kind": "test",
        "title": "Retired login manual case (historical reference)",
        "layer": "manual-scripted",
        "testExecutionMode": "real",
        "existing": true,
        "deleted": true,
        "sourceArtifactIds": [
          "qeg:artifact-positive-placement-change-retirement"
        ],
        "traceability": {
          "sourceRefs": [
            {
              "id": "qeg:retired-case-source",
              "path": "gate-input.json",
              "label": "/placementPlan/placement_changes/subject_id"
            }
          ],
          "confidence": "high",
          "assumptions": [
            "Retired case remains addressable; deletion does not count as an execution or current coverage."
          ]
        }
      }
    ],
    "edges": [
      {
        "id": "qeg:edge-risk-login-replaced-by-aete",
        "kind": "replaced_by",
        "from": "mbb:CASE-login-001",
        "to": "hate:AETE-login-001",
        "traceability": {
          "sourceRefs": [
            {
              "id": "qeg:sr-placement-change-login",
              "path": "placement/changes/login-retirement.json"
            }
          ],
          "assumptions": [],
          "confidence": "high"
        }
      }
    ],
    "completeness": {
      "score": 1,
      "partial": false,
      "parserFailures": [],
      "unsupportedClaims": []
    }
  },
  "placementPlan": {
    "metadata": {
      "qegVersion": "0.2",
      "runId": "qeg:run-positive-placement-change-retirement",
      "createdAt": "2026-07-02T00:00:00.000Z",
      "profile": "ipo_controlled",
      "inputArtifacts": [
        {
          "id": "qeg:artifact-positive-placement-change-retirement",
          "adapter": "qeg-native",
          "kind": "test_model",
          "path": "artifacts/input.json",
          "contentHash": "sha256:ee4e3d131531183991b409e2952fb46350ccc4e6fdd0c6fe8c746b7519a15a62"
        }
      ],
      "requiredConnectorStatus": {
        "qeg-native": "success"
      }
    },
    "obligations": [
      {
        "id": "qeg:obligation-login",
        "requirementIds": [],
        "riskIds": [
          "qeg:risk-login-regression"
        ],
        "failureModeIds": [],
        "changedCodeIds": [],
        "priority": "P1",
        "riskPriorityIndex": 10,
        "gateRelevance": "blocking",
        "traceability": {
          "sourceRefs": [
            {
              "id": "qeg:sr-obligation-login",
              "path": "placement/obligations/login.json"
            }
          ],
          "assumptions": [],
          "confidence": "high"
        }
      }
    ],
    "placements": [
      {
        "id": "qeg:placement-login-manual-original",
        "kind": "test_placement",
        "title": "Original manual login case placement",
        "traceability": {
          "sourceRefs": [
            {
              "id": "qeg:sr-placement-login",
              "path": "placement/original/login-manual.json"
            }
          ],
          "assumptions": [],
          "confidence": "high"
        },
        "sourceArtifactIds": [],
        "obligationId": "qeg:obligation-login",
        "primaryLayer": "manual-scripted",
        "disposition": "manual-only",
        "gateRelevance": "blocking",
        "candidateScores": [],
        "selectedTestIds": [
          "mbb:CASE-login-001"
        ]
      }
    ],
    "placement_changes": [
      {
        "id": "qeg:placement-change-login-retirement",
        "subject_id": "mbb:CASE-login-001",
        "from_layer": "manual-scripted",
        "to_layer": "automated",
        "replacement_ids": [
          "hate:AETE-login-001"
        ],
        "evidence_refs": [
          {
            "id": "hate:ev-login-green",
            "path": "hate/reports/login-aete.json",
            "evidenceKind": "test_result",
            "capturedAt": "2026-07-02T00:00:00.000Z"
          }
        ],
        "policy_ref": "qeg:policy-ipo-controlled-001",
        "decided_by": "reviewer-001",
        "decided_at": "2026-07-02T00:00:00.000Z",
        "reversible": true,
        "revert_condition": "replacement evidenceStrength < 0.9 or recentGreenRuns < 3 or risk coverage missing"
      }
    ],
    "manual_case_inventory": {
      "previous_subject_ids": [
        "mbb:CASE-login-001"
      ],
      "current_subject_ids": [],
      "sourceRefs": [
        {
          "id": "mbb:sr-manual-inventory",
          "path": "manual-bb/manual-case-inventory.json"
        }
      ]
    }
  },
  "gate": {
    "evaluationScope": {
      "kind": "fixture",
      "target": "positive-placement-change-retirement",
      "notEvaluated": [
        "Upstream producer ingestion",
        "Real deployment",
        "Release approval"
      ]
    },
    "metadata": {
      "qegVersion": "0.2",
      "runId": "qeg:run-positive-placement-change-retirement",
      "createdAt": "2026-07-02T00:00:00.000Z",
      "profile": "ipo_controlled",
      "inputArtifacts": [
        {
          "id": "qeg:artifact-positive-placement-change-retirement",
          "adapter": "qeg-native",
          "kind": "test_model",
          "path": "artifacts/input.json",
          "contentHash": "sha256:ee4e3d131531183991b409e2952fb46350ccc4e6fdd0c6fe8c746b7519a15a62"
        }
      ],
      "requiredConnectorStatus": {
        "qeg-native": "success"
      }
    },
    "verdict": "go",
    "reasons": [
      "All gate conditions satisfied"
    ],
    "disqualifications": [],
    "blockers": [],
    "residualRisks": [],
    "requiredHumanReview": [],
    "testEvidenceAccounting": {
      "countedTestIds": [
        "hate:AETE-login-001"
      ],
      "excludedMockTests": []
    },
    "reliability": {
      "enabled": false
    }
  },
  "exports": [
    {
      "kind": "json",
      "path": "qeg.bundle.json",
      "contentHash": "sha256:0c56837b7b2c276be4611ce9af375f609604f980c10ade9a51b6d37caa431fca"
    },
    {
      "kind": "json",
      "path": "test-placement-plan.json",
      "contentHash": "sha256:3dbd30f3c4a5de7a6c42cdab7ba656dfa5900f7fe28350b1a2d03e0721fd4b71"
    },
    {
      "kind": "json",
      "path": "gate-verdict.json",
      "contentHash": "sha256:e4888b3eb4039f47cb0af179d72bd261b2f2015e8ce39d8375cb4b5fc5572954"
    },
    {
      "kind": "markdown",
      "path": "quality-evidence-record.md",
      "contentHash": "sha256:62c6d5d6adc2c365f65a803d6e471301aac8821733a0311cb9744249e574c9bf"
    }
  ],
  "auditTrail": {
    "evidencePackageHash": "sha256:placement-change-retirement",
    "approvalEvidenceSummary": [],
    "gatePolicyHash": "sha256:abc123",
    "gatePolicyId": "qeg:policy-ipo-controlled-001"
  }
}
